{
  "$schema": "../../data_schema/corroboration_profile.schema.json",
  "profile_id": "project05-corroboration-source-groups-v0.1",
  "version": "0.1.0",
  "status": "frozen_mapping",
  "created_utc": "2026-07-13T16:00:00Z",
  "scope": {
    "case_ids": [
      "C07-darpa-e5-theia-0515",
      "C08-darpa-e5-clearscope-0515",
      "C09-darpa-optc-sysclient0201-0923",
      "C10-darpa-optc-sysclient0351-0925",
      "C11-otrf-apt29-day1-scranton-nashua",
      "C12-witfoo-precinct6-f10c7270"
    ]
  },
  "grouping_unit": "provider_or_source_family",
  "independence_boundary": "Groups distinguish provider/source families, not organizations, sensors, or statistically independent observations. Source-group results are a corroboration diagnostic and must not be described as independent-source proof.",
  "assignments": [
    {
      "case_id": "C07-darpa-e5-theia-0515",
      "claim_id": "C07-EC-001",
      "source_group": "darpa_e5_r04_pidsmaker_event_table_network_summary",
      "basis": "artifact_id plus source_type fallback"
    },
    {
      "case_id": "C07-darpa-e5-theia-0515",
      "claim_id": "C07-EC-002",
      "source_group": "darpa_e5_r04_pidsmaker_event_table_provenance_graph",
      "basis": "artifact_id plus source_type fallback"
    },
    {
      "case_id": "C07-darpa-e5-theia-0515",
      "claim_id": "C07-EC-003",
      "source_group": "darpa_e5_r04_pidsmaker_event_table_provenance_graph",
      "basis": "artifact_id plus source_type fallback"
    },
    {
      "case_id": "C07-darpa-e5-theia-0515",
      "claim_id": "C07-EC-004",
      "source_group": "darpa_e5_r04_pidsmaker_event_table_local_log",
      "basis": "artifact_id plus source_type fallback"
    },
    {
      "case_id": "C07-darpa-e5-theia-0515",
      "claim_id": "C07-EC-005",
      "source_group": "darpa_e5_r04_pidsmaker_event_table_local_log",
      "basis": "artifact_id plus source_type fallback"
    },
    {
      "case_id": "C08-darpa-e5-clearscope-0515",
      "claim_id": "C08-EC-001",
      "source_group": "darpa_e5_r05_pidsmaker_event_table_network_summary",
      "basis": "artifact_id plus source_type fallback"
    },
    {
      "case_id": "C08-darpa-e5-clearscope-0515",
      "claim_id": "C08-EC-002",
      "source_group": "darpa_e5_r05_pidsmaker_event_table_provenance_graph",
      "basis": "artifact_id plus source_type fallback"
    },
    {
      "case_id": "C08-darpa-e5-clearscope-0515",
      "claim_id": "C08-EC-003",
      "source_group": "darpa_e5_r05_pidsmaker_event_table_provenance_graph",
      "basis": "artifact_id plus source_type fallback"
    },
    {
      "case_id": "C08-darpa-e5-clearscope-0515",
      "claim_id": "C08-EC-004",
      "source_group": "darpa_e5_r05_pidsmaker_event_table_local_log",
      "basis": "artifact_id plus source_type fallback"
    },
    {
      "case_id": "C09-darpa-optc-sysclient0201-0923",
      "claim_id": "C09-EC-001",
      "source_group": "darpa_optc_r06_sysclient0201_ecar_window_network_summary",
      "basis": "artifact_id plus source_type fallback"
    },
    {
      "case_id": "C09-darpa-optc-sysclient0201-0923",
      "claim_id": "C09-EC-002",
      "source_group": "darpa_optc_r06_sysclient0201_ecar_window_host_forensics",
      "basis": "artifact_id plus source_type fallback"
    },
    {
      "case_id": "C09-darpa-optc-sysclient0201-0923",
      "claim_id": "C09-EC-003",
      "source_group": "darpa_optc_r06_sysclient0201_ecar_window_host_forensics",
      "basis": "artifact_id plus source_type fallback"
    },
    {
      "case_id": "C09-darpa-optc-sysclient0201-0923",
      "claim_id": "C09-EC-004",
      "source_group": "darpa_optc_r06_sysclient0201_ecar_window_host_forensics",
      "basis": "artifact_id plus source_type fallback"
    },
    {
      "case_id": "C09-darpa-optc-sysclient0201-0923",
      "claim_id": "C09-EC-005",
      "source_group": "darpa_optc_r06_sysclient0201_ecar_window_local_log",
      "basis": "artifact_id plus source_type fallback"
    },
    {
      "case_id": "C10-darpa-optc-sysclient0351-0925",
      "claim_id": "C10-EC-001",
      "source_group": "darpa_optc_r07_sysclient0351_ecar_window_host_forensics",
      "basis": "artifact_id plus source_type fallback"
    },
    {
      "case_id": "C10-darpa-optc-sysclient0351-0925",
      "claim_id": "C10-EC-002",
      "source_group": "darpa_optc_r07_sysclient0351_ecar_window_host_forensics",
      "basis": "artifact_id plus source_type fallback"
    },
    {
      "case_id": "C10-darpa-optc-sysclient0351-0925",
      "claim_id": "C10-EC-003",
      "source_group": "darpa_optc_r07_sysclient0351_ecar_window_network_summary",
      "basis": "artifact_id plus source_type fallback"
    },
    {
      "case_id": "C10-darpa-optc-sysclient0351-0925",
      "claim_id": "C10-EC-004",
      "source_group": "darpa_optc_r07_sysclient0351_ecar_window_host_forensics",
      "basis": "artifact_id plus source_type fallback"
    },
    {
      "case_id": "C10-darpa-optc-sysclient0351-0925",
      "claim_id": "C10-EC-005",
      "source_group": "darpa_optc_r07_sysclient0351_ecar_window_local_log",
      "basis": "artifact_id plus source_type fallback"
    },
    {
      "case_id": "C11-otrf-apt29-day1-scranton-nashua",
      "claim_id": "C11-EC-001",
      "source_group": "scranton:windows_powershell",
      "basis": "C11 source_pointer.record_id host and Windows provider family"
    },
    {
      "case_id": "C11-otrf-apt29-day1-scranton-nashua",
      "claim_id": "C11-EC-002",
      "source_group": "scranton:windows_sysmon",
      "basis": "C11 source_pointer.record_id host and Windows provider family"
    },
    {
      "case_id": "C11-otrf-apt29-day1-scranton-nashua",
      "claim_id": "C11-EC-003",
      "source_group": "scranton:windows_powershell",
      "basis": "C11 source_pointer.record_id host and Windows provider family"
    },
    {
      "case_id": "C11-otrf-apt29-day1-scranton-nashua",
      "claim_id": "C11-EC-004",
      "source_group": "scranton:windows_security",
      "basis": "C11 source_pointer.record_id host and Windows provider family"
    },
    {
      "case_id": "C11-otrf-apt29-day1-scranton-nashua",
      "claim_id": "C11-EC-005",
      "source_group": "scranton:windows_powershell",
      "basis": "C11 source_pointer.record_id host and Windows provider family"
    },
    {
      "case_id": "C11-otrf-apt29-day1-scranton-nashua",
      "claim_id": "C11-EC-006",
      "source_group": "scranton:windows_security",
      "basis": "C11 source_pointer.record_id host and Windows provider family"
    },
    {
      "case_id": "C11-otrf-apt29-day1-scranton-nashua",
      "claim_id": "C11-EC-007",
      "source_group": "nashua:windows_powershell",
      "basis": "C11 source_pointer.record_id host and Windows provider family"
    },
    {
      "case_id": "C11-otrf-apt29-day1-scranton-nashua",
      "claim_id": "C11-EC-008",
      "source_group": "nashua:windows_sysmon",
      "basis": "C11 source_pointer.record_id host and Windows provider family"
    },
    {
      "case_id": "C12-witfoo-precinct6-f10c7270",
      "claim_id": "C12-EC-001",
      "source_group": "asa_firewall",
      "basis": "C12 ASA artifact/location/blocked-flow predicate family"
    },
    {
      "case_id": "C12-witfoo-precinct6-f10c7270",
      "claim_id": "C12-EC-002",
      "source_group": "asa_firewall",
      "basis": "C12 ASA artifact/location/blocked-flow predicate family"
    },
    {
      "case_id": "C12-witfoo-precinct6-f10c7270",
      "claim_id": "C12-EC-003",
      "source_group": "windows_ad",
      "basis": "C12 Windows Event predicate family"
    },
    {
      "case_id": "C12-witfoo-precinct6-f10c7270",
      "claim_id": "C12-EC-004",
      "source_group": "windows_ad",
      "basis": "C12 Windows Event predicate family"
    },
    {
      "case_id": "C12-witfoo-precinct6-f10c7270",
      "claim_id": "C12-EC-005",
      "source_group": "precinct_projection",
      "basis": "C12 vendor GraphML projection family"
    }
  ],
  "node_audit": [
    {
      "case_id": "C07-darpa-e5-theia-0515",
      "node_id": "N01_firefox_c2",
      "required_claim_count": 1,
      "source_group_count": 1,
      "claim_count_overstates_source_groups": false
    },
    {
      "case_id": "C07-darpa-e5-theia-0515",
      "node_id": "N02_binfmt_elevation",
      "required_claim_count": 1,
      "source_group_count": 1,
      "claim_count_overstates_source_groups": false
    },
    {
      "case_id": "C07-darpa-e5-theia-0515",
      "node_id": "N03_sshd_artifact",
      "required_claim_count": 1,
      "source_group_count": 1,
      "claim_count_overstates_source_groups": false
    },
    {
      "case_id": "C08-darpa-e5-clearscope-0515",
      "node_id": "N01_appstarter_c2",
      "required_claim_count": 1,
      "source_group_count": 1,
      "claim_count_overstates_source_groups": false
    },
    {
      "case_id": "C08-darpa-e5-clearscope-0515",
      "node_id": "N02_elevate_msm",
      "required_claim_count": 1,
      "source_group_count": 1,
      "claim_count_overstates_source_groups": false
    },
    {
      "case_id": "C08-darpa-e5-clearscope-0515",
      "node_id": "N03_screencap",
      "required_claim_count": 1,
      "source_group_count": 1,
      "claim_count_overstates_source_groups": false
    },
    {
      "case_id": "C09-darpa-optc-sysclient0201-0923",
      "node_id": "N01_empire_c2",
      "required_claim_count": 1,
      "source_group_count": 1,
      "claim_count_overstates_source_groups": false
    },
    {
      "case_id": "C09-darpa-optc-sysclient0201-0923",
      "node_id": "N02_uac_windir",
      "required_claim_count": 1,
      "source_group_count": 1,
      "claim_count_overstates_source_groups": false
    },
    {
      "case_id": "C09-darpa-optc-sysclient0201-0923",
      "node_id": "N03_screenshot",
      "required_claim_count": 1,
      "source_group_count": 1,
      "claim_count_overstates_source_groups": false
    },
    {
      "case_id": "C09-darpa-optc-sysclient0201-0923",